{
  "schemaVersion": 1,
  "decisionId": "intake-capability-profiles-v1",
  "createdAt": "2026-07-13T06:00:00Z",
  "outcome": {
    "statement": "Add capability-compiled provider execution and extract provider-action handling without enabling network or external effects.",
    "deliverables": [
      "authority profile policy and schema",
      "neutral compiler",
      "Codex and Claude compilation targets",
      "offline workspace-write acceptance fixtures",
      "provider-action command handler and stores",
      "receipt and projection fields"
    ],
    "acceptanceKnown": true,
    "nonGoals": [
      "network access",
      "release or deployment effects",
      "optional provider redesign",
      "Console redesign",
      "distributed services"
    ]
  },
  "route": "scoped",
  "ambiguity": {
    "level": "medium",
    "openDecisions": [
      "exact provider-native settings for the offline write profile",
      "final bounded-context names"
    ]
  },
  "risk": {
    "level": "high",
    "factors": [
      "filesystem-write-authority",
      "provider-permission-compilation",
      "recovery-and-idempotency",
      "large-core-refactor"
    ],
    "oneWayDoors": []
  },
  "authority": {
    "status": "missing",
    "presentScopes": [
      "read-only-review"
    ],
    "missingScopes": [
      "implementation",
      "worktree-creation",
      "branch-or-pr-effects-if-used"
    ]
  },
  "decomposition": {
    "parallelValue": "high",
    "coupling": "medium",
    "candidateRoles": [
      {
        "role": "chair",
        "taskClass": "architecture-and-integration",
        "routeIntent": "flagship",
        "preferredFamily": "openai-or-anthropic",
        "effort": "xhigh"
      },
      {
        "role": "contract-writer",
        "taskClass": "provider-conformance",
        "routeIntent": "workhorse",
        "preferredFamily": "other-primary",
        "effort": "high"
      },
      {
        "role": "adapter-specialist",
        "taskClass": "provider-native-permissions",
        "routeIntent": "flagship",
        "preferredFamily": "matching-provider",
        "effort": "high"
      },
      {
        "role": "reviewer",
        "taskClass": "security-and-recovery-review",
        "routeIntent": "flagship",
        "preferredFamily": "other-primary",
        "effort": "high"
      }
    ]
  },
  "evidence": {
    "deterministic": [
      "schema validation",
      "profile subset/property tests",
      "workspace escape tests",
      "provider conformance",
      "crash/replay/reconciliation tests",
      "clean-checkout full gate"
    ],
    "judgement": [
      "fresh native review",
      "other-primary architecture/security review"
    ],
    "liveOrHuman": [
      "bounded real-provider workspace-write acceptance",
      "final human acceptance"
    ]
  },
  "freshSession": {
    "recommended": true,
    "atPhase": "implementation-after-scope-approval",
    "reason": "The review corpus is broad and implementation requires a clean, authority-bound context."
  },
  "humanAttention": [
    {
      "decision": "Approve the first implementation tranche and its exact worktree/write authority.",
      "blocking": true,
      "recommendedDefault": "Approve only the offline workspace-write profile and provider-action extraction.",
      "alternatives": [
        "approve policy/schema only",
        "defer implementation",
        "broaden to network/effects (not recommended)"
      ]
    },
    {
      "decision": "Select Codex or Claude as implementation chair.",
      "blocking": false,
      "recommendedDefault": "Use the current session's strongest available primary and require the other primary as challenge/reviewer.",
      "alternatives": [
        "Codex chair",
        "Claude chair"
      ]
    }
  ]
}
